{
  "schema_version": 1,
  "calculation_method": "PBE+U; U_Ni=? eV",
  "components": [
    "Li",
    "Ni",
    "O"
  ],
  "independent_chemical_potentials": {
    "Li": {
      "model": "intercalation_voltage",
      "reference_energy_ev_per_component": -1.89965,
      "electrons_per_component": 1,
      "voltage_reference": "Li/Li+"
    },
    "O": {
      "model": "fixed_pressure_oxygen",
      "raw_o2_energy_ev_per_molecule": -9.86018,
      "correction_ev_per_molecule": 1.36
    }
  },
  "reference_phases": [
    {
      "reference_id": "bulk-LiNiO2",
      "composition": {
        "Li": 1,
        "Ni": 1,
        "O": 2
      },
      "energy_ev_per_formula_unit": -19.92283375
    }
  ],
  "diagram": {
    "x_axis": {
      "state_variable": "voltage",
      "label": "Potential vs. Li/Li+",
      "unit": "V"
    },
    "y_axis": {
      "state_variable": "temperature",
      "label": "Temperature",
      "unit": "K"
    }
  },
  "datasets": [
    {
      "dataset_id": "li",
      "path": "li-terminated.dat",
      "number_of_surfaces": 2
    },
    {
      "dataset_id": "ni",
      "path": "ni-terminated.dat",
      "number_of_surfaces": 2
    }
  ],
  "alignments": [
    {
      "reference_dataset_id": "li",
      "target_dataset_id": "ni",
      "reference_anchor_phase_id": "Li8Ni12O24_3-phase-25",
      "target_anchor_phase_id": "full-O-full-Li",
      "bulk_reference_id": "bulk-LiNiO2"
    }
  ]
}
